url,name,address,city,state,phone
https://florenceaccounting.com/,Florence Accounting LLC,"595 S Main St, Florence, AZ 85132",Florence,AZ,(520) 868-1040
https://johnsoncpa.group/,"Johnson CPA Group, PLLC","1760 E Pecos Rd #326, Gilbert, AZ 85295",Gilbert,AZ,(480) 895-0882
https://www.pinpointeaccounting.com/?utm_source=google&utm_medium=google_business_profile&utm_campaign=website_click,"Pinpointe Accounting Services, CPA, PC","7333 E Tanque Verde Rd, Tucson, AZ 85715",Tucson,AZ,(520) 795-7505
http://www.redrockazcpas.com/,Red Rock Accounting Group LLC,"1290 AZ-260, Cottonwood, AZ 86326",Cottonwood,AZ,(928) 634-9465
https://srncpa.com/,"Neuwirth and Ashford CPAs, PLLC","10575 N 114th St Suite 103, Scottsdale, AZ 85259",Scottsdale,AZ,(480) 393-0755
https://www.barryandmoore.com/,"Barry & Moore, CPAs","2198 E Camelback Rd Ste 370, Phoenix, AZ 85016",Phoenix,AZ,(602) 277-5463
